{
  "dialect": "vayu-core",
  "version": 2,

  "sections": {
    "system":  { "title": "Link & system", "doc": "Liveness, health, status text, acks, time sync, arming and flight mode." },
    "flight":  { "title": "Flight", "doc": "What the vehicle senses, estimates and is tuned with.",
      "sections": {
        "sensors":     { "title": "Sensors", "doc": "Raw sensor and RC input, and the battery." },
        "state":       { "title": "State & control", "doc": "Estimated state, control-loop trace, motor output, live notch." },
        "tuning":      { "title": "Tuning & filters", "doc": "PID gains, filter cutoffs and motor geometry." },
        "calibration": { "title": "Calibration", "doc": "Sensor calibration commands and their progress." },
        "sysid":       { "title": "System ID", "doc": "Excitation and capture for plant identification." }
      } },
    "storage": { "title": "Storage & services", "doc": "Moving data and settings on and off the vehicle.",
      "sections": {
        "xfer":  { "title": "File transfer", "doc": "The XFER bulk-transfer substrate." },
        "fs":    { "title": "Filesystem", "doc": "SD-card listing, info and delete." },
        "param": { "title": "Parameters", "doc": "Parameter list, read and set." }
      } },
    "diag":    { "title": "Diagnostics", "doc": "Runtime performance and bench hardware tests.",
      "sections": {
        "perf":   { "title": "Performance", "doc": "Task, FIFO, estimator and logger timing." },
        "hwtest": { "title": "Hardware test", "doc": "Test-profile-only bench test messages." }
      } }
  },

  "enums": {
    "command_result": {
      "section": "system",
      "doc": "COMMAND_ACK.result (spec §17).",
      "entries": [
        { "name": "ACCEPTED",             "value": 0 },
        { "name": "TEMPORARILY_REJECTED", "value": 1 },
        { "name": "DENIED",               "value": 2 },
        { "name": "UNSUPPORTED",          "value": 3 },
        { "name": "FAILED",               "value": 4 },
        { "name": "IN_PROGRESS",          "value": 5 }
      ]
    },
    "time_sync_role": {
      "section": "system",
      "doc": "TIME_SYNC.role (spec §10).",
      "entries": [
        { "name": "REQUEST",      "value": 0 },
        { "name": "RESPONSE",     "value": 1 },
        { "name": "REQUEST_WIDE", "value": 2 }
      ]
    },
    "param_type": {
      "section": "storage.param",
      "doc": "PARAM_VALUE.type / PARAM_SET.type (spec §17).",
      "entries": [
        { "name": "U8",  "value": 1 },  { "name": "I8",  "value": 2 },
        { "name": "U16", "value": 3 },  { "name": "I16", "value": 4 },
        { "name": "U32", "value": 5 },  { "name": "I32", "value": 6 },
        { "name": "U64", "value": 7 },  { "name": "I64", "value": 8 },
        { "name": "F32", "value": 9 },  { "name": "F64", "value": 10 }
      ]
    },
    "sec_mode": {
      "section": "system",
      "doc": "CAPABILITIES.sec_modes bitmask (spec §17).",
      "entries": [
        { "name": "NONE",    "value": 1 },
        { "name": "SIGN",    "value": 2 },
        { "name": "ENCRYPT", "value": 4 }
      ]
    },
    "nav_state": {
      "section": "system",
      "doc": "HEARTBEAT.nav_state. Sequential v2 encoding of the firmware flight-state machine.",
      "entries": [
        { "name": "UNINITIALIZED", "value": 0 },
        { "name": "INIT",          "value": 1 },
        { "name": "STANDBY",       "value": 2 },
        { "name": "PREARM",        "value": 3 },
        { "name": "ARMED",         "value": 4 },
        { "name": "IN_AIR",        "value": 5 },
        { "name": "FAILSAFE",      "value": 6 },
        { "name": "TERMINATED",    "value": 7 },
        { "name": "CALIBRATING",   "value": 8 }
      ]
    },
    "flight_mode": {
      "section": "system",
      "doc": "FLIGHT_MODE.mode / CMD_SET_FLIGHT_MODE.mode.",
      "entries": [
        { "name": "ANGLE",         "value": 0 },
        { "name": "ACRO",          "value": 1 },
        { "name": "RELEASE_TO_RC", "value": 2 }
      ]
    },
    "mode_source": {
      "section": "system",
      "doc": "Who selected the active flight mode.",
      "entries": [
        { "name": "RC",  "value": 0 },
        { "name": "GCS", "value": 1 }
      ]
    },
    "pid_controller": {
      "section": "flight.tuning",
      "doc": "CMD_SET_PID.controller — which control loop.",
      "entries": [
        { "name": "ANGLE", "value": 0 },
        { "name": "RATE",  "value": 1 }
      ]
    },
    "pid_axis": {
      "section": "flight.tuning",
      "doc": "CMD_SET_PID.axis / CMD_SET_GYRO_LPF.axis.",
      "entries": [
        { "name": "ROLL",  "value": 0 },
        { "name": "PITCH", "value": 1 },
        { "name": "YAW",   "value": 2 }
      ]
    },
    "severity": {
      "section": "system",
      "doc": "STATUSTEXT.severity (syslog-style).",
      "entries": [
        { "name": "EMERGENCY", "value": 0 }, { "name": "ALERT",  "value": 1 },
        { "name": "CRITICAL",  "value": 2 }, { "name": "ERROR",  "value": 3 },
        { "name": "WARNING",   "value": 4 }, { "name": "NOTICE", "value": 5 },
        { "name": "INFO",      "value": 6 }, { "name": "DEBUG",  "value": 7 }
      ]
    },
    "calib_step": {
      "section": "flight.calibration",
      "doc": "CALIBRATION_STATUS.step — progress update or operator instruction (spec §14.8).",
      "entries": [
        { "name": "PROGRESS",          "value": 0 },
        { "name": "NOSE_UP",           "value": 1 },
        { "name": "NOSE_DOWN",         "value": 2 },
        { "name": "RIGHT_DOWN",        "value": 3 },
        { "name": "LEFT_DOWN",         "value": 4 },
        { "name": "UPRIGHT",           "value": 5 },
        { "name": "UPSIDE_DOWN",       "value": 6 },
        { "name": "FREE_ROT",          "value": 7 },
        { "name": "MAG_AXIS_COVERAGE", "value": 8 },
        { "name": "COMPLETE",          "value": 9 },
        { "name": "FAILED",            "value": 10 },
        { "name": "EDGE_1",            "value": 11 },
        { "name": "EDGE_2",            "value": 12 },
        { "name": "EDGE_3",            "value": 13 },
        { "name": "EDGE_4",            "value": 14 },
        { "name": "EDGE_5",            "value": 15 },
        { "name": "EDGE_6",            "value": 16 },
        { "name": "BOARD_LEVEL",       "value": 17 }
      ]
    },
    "perf_fifo_id": {
      "section": "diag.perf",
      "doc": "PERF_FIFO.fifo_id — stable ids so rows label regardless of send order (spec §14.8).",
      "entries": [
        { "name": "IMU_RAW",            "value": 0 },
        { "name": "IMU_TELEMETRY",      "value": 1 },
        { "name": "IMU_CONTROL",        "value": 2 },
        { "name": "IMU_CALIB",          "value": 3 },
        { "name": "IMU_CALIB_TELEM",    "value": 4 },
        { "name": "ATTITUDE_TELEMETRY", "value": 5 },
        { "name": "ATTITUDE_CONTROL",   "value": 6 },
        { "name": "RC_TELEMETRY",       "value": 7 },
        { "name": "RC_CONTROL",         "value": 8 },
        { "name": "TELEMETRY",          "value": 9 }
      ]
    },
    "xfer_flags": {
      "section": "storage.xfer",
      "doc": "XFER_DATA/XFER_ACK.flags — bitmask carried on the bulk-transfer substrate (docs/plans/navlink-xfer-substrate.md). DONE/ABORT terminate a session; NAK requests resend from XFER_ACK.next_offset; EOF marks the final XFER_DATA chunk.",
      "entries": [
        { "name": "NONE",  "value": 0 },
        { "name": "DONE",  "value": 1 },
        { "name": "NAK",   "value": 2 },
        { "name": "ABORT", "value": 4 },
        { "name": "EOF",   "value": 8 }
      ]
    },
    "battery_flags": {
      "section": "flight.sensors",
      "doc": "BATTERY.flags \u2014 bitmask saying whether the pack voltage can be believed, and when it cannot, why. PRESENT and CONVERTED are the two that must both be set for `voltage` to mean a pack: CONVERTED says the ADC produced a reading, PRESENT says the reading is above the board's presence floor. They are separate because a disconnected pack does NOT read zero -- the divider keeps measuring the battery-side rail, which sits on residual charge in the ESC capacitors and converts perfectly, so a conversion succeeding says nothing about a pack being there. TIMEOUT and INIT_FAIL are the reasons CONVERTED can be clear. RAILED means the count is at full scale, which is a reference or wiring fault rather than a very large pack, and is called out because such a reading would otherwise pass the presence floor and be believed. The floor is a PRESENCE test, not a health test: cell count is not sensed, so a dangerously flat pack still reports PRESENT and its voltage is to be trusted.",
      "entries": [
        { "name": "NONE",      "value": 0 },
        { "name": "PRESENT",   "value": 1 },
        { "name": "CONVERTED", "value": 2 },
        { "name": "TIMEOUT",   "value": 4 },
        { "name": "INIT_FAIL", "value": 8 },
        { "name": "RAILED",    "value": 16 }
      ]
    }
  },

  "messages": [
    {
      "msgid": 0, "name": "HEARTBEAT", "replaces": "0x0", "section": "system",
      "doc": "~1 Hz liveness, mode, advertised capabilities, wall-clock stamp.",
      "fields": [
        { "index": 0, "name": "type",          "type": "u8",  "doc": "vehicle type" },
        { "index": 1, "name": "autopilot",     "type": "u8" },
        { "index": 2, "name": "base_mode",     "type": "u8" },
        { "index": 3, "name": "system_status", "type": "u8" },
        { "index": 4, "name": "nav_state",     "type": "u8",  "enum": "nav_state" },
        { "index": 5, "name": "capabilities",  "type": "u32", "doc": "capability bitmask (spec §13)" },
        { "index": 6, "name": "timestamp",     "type": "u32", "doc": "wall-clock [s:20|ms:12] (spec §6.1)" }
      ]
    },
    {
      "msgid": 2, "name": "SYSTEM_HEALTH", "replaces": "0x6/0x02", "section": "system",
      "doc": "Firmware health counters. v1: SYSTEM_STATUS origin HEALTH.",
      "fields": [